{
  "$schema": "./schema.json",
  "id": "EVD-0005",
  "claim": "All 10 Phase 6 remediation items for Fundacion were applied, verified, and built cleanly.",
  "status": "VERIFIED",
  "scope": "Fundacion Controlled Remediation",
  "source": "Phase 7 Remediation Execution & Build Audit",
  "timestamp": "2026-08-10T23:08:00Z",
  "actor": "EOS Remediation Orchestrator",
  "action": "Remediated A11Y-001, A11Y-002, Q-001, BQA-001, SEC-001, SEC-002, SEC-003, PERF-001, SEO-001, SEO-002.",
  "command": "npm run build in C:\\Users\\valen\\Documents\\Fundacion",
  "expected": "Clean Vite production build with sub-20KB bundle and zero errors.",
  "actual": "Vite build succeeded in 258ms. Total minified bundle is 16.55 kB (dist/index.html 8.45kB, index.css 5.95kB, index.js 2.15kB).",
  "result": "PASS",
  "artifacts": [
    "C:\\Users\\valen\\Documents\\Fundacion\\index.html",
    "C:\\Users\\valen\\Documents\\Fundacion\\src\\styles\\main.css",
    "C:\\Users\\valen\\Documents\\Fundacion\\src\\js\\main.js",
    "C:\\Users\\valen\\Documents\\Fundacion\\robots.txt",
    "C:\\Users\\valen\\Documents\\Fundacion\\sitemap.xml",
    "C:\\Users\\valen\\Documents\\Fundacion\\package.json"
  ],
  "logs": [
    "A11Y-001: Hamburger icon 3-bar styling added to main.css",
    "A11Y-002: prefers-reduced-motion media query added to main.css",
    "Q-001: node_modules installed via npm install",
    "BQA-001: test script added to package.json",
    "SEC-001: sanitizeInput helper & server sanitization note added to main.js",
    "SEC-002 & SEC-003: CSP meta tag & JSON-LD context note added to index.html",
    "PERF-001: SVG data URI favicon added to index.html",
    "SEO-001 & SEO-002: Canonical link added to index.html; robots.txt & sitemap.xml created"
  ],
  "environment": {
    "os": "Windows 11",
    "node": "v24.16.0"
  },
  "confidence": "HIGH",
  "risks": ["Real client assets pending upload (GAP-001)"],
  "limitations": ["Production release requires Level 4 release readiness certification"],
  "related_spec": "docs/specs/fundacion/SPEC-0001-fundacion-core.md",
  "related_project": "PRJ-FUNDACION",
  "related_change": "64800dc"
}
