{
  "$schema": "./schema.json",
  "id": "EVD-0021",
  "claim": "EOS Phase 22 Autonomous Adversarial Engineering, Chaos & Resilience Proving completed: Adversarial Truth Principle, ADVERSARIAL_ATTACK_TAXONOMY.json (16 targets, 15 objectives), BLAST_RADIUS_MODEL.json (B0-B7, active B0-B3), RESILIENCE_MODEL.json (5 capabilities: Detect, Contain, Recover, Verify, Learn), GAME_DAY_STATE_MACHINE.json (17 states), AdversarialLaboratoryEngine (steady state verification, hypothesis-driven format, blast radius limits, 15 failure scenarios, resilience scoring, anti-self-deception checks, proposal-only evolution), 5 synthetic adversarial fixtures, gameday:run CLI script, and 272 total suite tests verified with 100% pass rate and zero external side effects.",
  "status": "VERIFIED",
  "scope": "EOS Control Plane Autonomous Adversarial Laboratory & Resilience Proving System",
  "source": "Phase 22 Adversarial Engineering Audit",
  "timestamp": "2026-08-11T03:16:05Z",
  "actor": "EOS Systems Architect & Adversarial Engineering Lead",
  "action": "Implemented Adversarial Laboratory Engine, Adversarial Truth Principle, Attack Taxonomy, Blast Radius Model, Resilience Model, Game Day State Machine, 5 synthetic adversarial fixtures, 15 failure injection scenarios, negative tests, and verified target isolation.",
  "command": "npm test & npm run verify:strict & npm run gameday:run",
  "expected": "Test suite 272/272 pass. Strict verification 300+ checks pass. Game Day CLI script PASS. Fundacion folder 0 items.",
  "actual": "Test suite 272/272 passed in 594ms. All 15 synthetic Game Day scenarios completed with 100% resilience metrics. External isolation check verified (0 items in Fundacion). Control plane version v0.3.0 established.",
  "result": "PASS",
  "artifacts": [
    "docs\\intelligence\\research\\RSC-0013-adversarial-engineering-chaos-resilience.json",
    "docs\\governance\\ADVERSARIAL_TRUTH_PRINCIPLE.md",
    "docs\\governance\\ADVERSARIAL_ATTACK_TAXONOMY.json",
    "docs\\governance\\BLAST_RADIUS_MODEL.json",
    "docs\\governance\\RESILIENCE_MODEL.json",
    "docs\\orchestration\\GAME_DAY_STATE_MACHINE.json",
    "scripts\\engine\\adversarial-laboratory-engine.js",
    "tests\\adversarial-chaos.test.js"
  ],
  "logs": [
    "Adversarial Truth Principle: ADVERSARIAL_TRUTH_PRINCIPLE.md active enforcing non-self-deception",
    "Adversarial Attack Taxonomy: 16 targets and 15 objectives operational in ADVERSARIAL_ATTACK_TAXONOMY.json",
    "Blast Radius Model: B0-B3 active with B4-B7 forbidden in BLAST_RADIUS_MODEL.json",
    "Resilience Model: Detect, Contain, Recover, Verify, Learn active in RESILIENCE_MODEL.json",
    "Game Day State Machine: 17 states operational in GAME_DAY_STATE_MACHINE.json",
    "Adversarial Laboratory Engine: AdversarialLaboratoryEngine operational in scripts/engine/adversarial-laboratory-engine.js",
    "Test Suite: 272/272 tests passed (100% pass rate in 594ms across 13 test suites)",
    "External Target Isolation: VERIFIED (0 items in Fundacion)"
  ],
  "environment": {
    "os": "Windows 11",
    "node": "v24.16.0"
  },
  "confidence": "HIGH",
  "risks": ["External implementation forbidden until Product Owner sign-off on 4 business GAPs"],
  "limitations": ["Adversarial laboratory operates in local synthetic mode prior to live commercial cloud infrastructure activation"],
  "related_spec": "docs/specs/fundacion/SPEC-0001-fundacion-core.md",
  "related_project": "PRJ-EOS-CONTROL-PLANE",
  "related_change": "fe11fd7"
}
