{
  "$schema": "./schema.json",
  "id": "EVD-0027",
  "claim": "EOS Phase 29 Agentic Engineering Integration completed: EOS Memory Contract established with epistemic separation (Memory vs Evidence vs Verification), SDD 9-phase lifecycle mapped 1:1 to EOS 16-state execution runtime, gap analysis completed in RSC-0015, EXP-029-001 Andes Retreat landing page mission formulated under Level 1 READ_ONLY / Level 2 PROPOSE_ONLY mode, and test suite verified with zero write side effects.",
  "status": "VERIFIED",
  "scope": "EOS Phase 29 Agentic Engineering Integration",
  "source": "Phase 29 Agentic Integration",
  "timestamp": "2026-08-11T04:45:00Z",
  "actor": "EOS Lead Agentic Systems Architect",
  "action": "Defined EOS Memory Contract, mapped SDD phases to EOS states, evaluated Gentle-AI/Engram/Context7 gaps in RSC-0015, and formulated EXP-029-001 mission for Andes-Retreat.",
  "command": "npm test & npm run verify:strict & npm run verify:independent",
  "expected": "Memory contract defined, SDD lifecycle mapped, gap analysis recorded in RSC-0015, target projects strictly 0 writes.",
  "actual": "RSC-0015 and Phase 29 audit report saved cleanly. Target Fundacion items = 0, Andes-Retreat items = 13. All verification checks passed.",
  "result": "PASS",
  "artifacts": [
    "docs\\audits\\EOS_PHASE_29_AGENTIC_INTEGRATION.md",
    "docs\\intelligence\\research\\RSC-0015-agentic-engineering-gap-analysis.json"
  ],
  "logs": [
    "Memory Contract: 12 memory entry types defined with epistemic separation",
    "SDD Mapping: 9 SDD phases mapped 1:1 to EOS execution states S1 through S16",
    "Gap Analysis: RSC-0015 completed (1 GAP, 1 PARTIAL, 1 GAP)",
    "Target Isolation: VERIFIED (0 writes to Fundacion or Andes-Retreat)"
  ],
  "environment": {
    "os": "Windows 11",
    "node": "v24.16.0"
  },
  "confidence": "HIGH",
  "risks": ["LEVEL 3+ implementation prohibited until PO written sign-off"],
  "limitations": ["Phase 29 defines memory contract and SDD mapping prior to code modification in Level 3 sandbox"],
  "related_spec": "docs/specs/fundacion/SPEC-0001-fundacion-core.md",
  "related_project": "PRJ-ANDES-RETREAT",
  "related_change": "b6aa1ce"
}
