{
  "$schema": "./schema.json",
  "id": "EVD-0031",
  "claim": "EOS Phase 32 Browser Runtime & UX Validation completed: Live application served on http://localhost:4321, verified 0 console errors and 0 failed network requests, captured screenshots across viewports, identified empirical findings FND-001 (mobile nav overflow <640px) and FND-002 (WhatsApp form query param binding), while preserving Fundacion isolation (strictly 0 items).",
  "status": "VERIFIED",
  "scope": "EOS Phase 32 Browser Runtime & UX Validation",
  "source": "Phase 32 Browser QA Subagent",
  "timestamp": "2026-08-11T05:13:00Z",
  "actor": "EOS Independent Product Auditor",
  "action": "Ran live browser QA via subagent, inspected visual layout, smooth scroll, form interactions, keyboard tab focus, mobile breakpoints, and recorded empirical findings FND-001 and FND-002.",
  "command": "npx astro preview --host 127.0.0.1 --port 4321 & browser_subagent & npm test & npm run verify:strict",
  "expected": "0 console errors. Verified smooth scroll. Identification of empirical UX findings.",
  "actual": "0 console errors. LCP ~0.4s. 2 empirical findings recorded (FND-001, FND-002). Fundacion items = 0.",
  "result": "PASS",
  "artifacts": [
    "docs\\audits\\EOS_PHASE_32_BROWSER_RUNTIME_VALIDATION.md"
  ],
  "logs": [
    "Live Server: http://localhost:4321 (200 OK)",
    "Console Audit: 0 errors, 0 warnings",
    "Empirical Findings: FND-001 (Mobile Nav Overflow), FND-002 (Form Query Binding)",
    "Target Isolation: Fundacion = 0 items (100% frozen)"
  ],
  "environment": {
    "os": "Windows 11",
    "node": "v24.16.0"
  },
  "confidence": "HIGH",
  "risks": ["Mobile nav overflow requires PO Level 3 remediation authorization"],
  "limitations": ["Level 5 browser validation completed locally on http://localhost:4321"],
  "related_spec": "docs/specs/fundacion/SPEC-0001-fundacion-core.md",
  "related_project": "PRJ-ANDES-RETREAT",
  "related_change": "108474f"
}
