{
  "$schema": "./schema.json",
  "id": "EVD-0025",
  "claim": "EOS Phase 26 Real Project Discovery & Understanding (EXP-026-001) completed: Level 1 READ_ONLY mode enforced, target Fundacion repository observed (0 items, 100% empty), 9 discovery state artifacts generated under docs/intelligence/real_projects/fundacion/, Anti-Hallucination Contract satisfied with explicit INFERENCE and HYPOTHESIS tagging, PASS_WITH_CONDITIONS decision state assigned, and test suite verified with zero external write side effects.",
  "status": "VERIFIED",
  "scope": "EOS Phase 26 Real Project Empirical Validation (EXP-026-001)",
  "source": "Phase 26 Real Project Discovery Engine",
  "timestamp": "2026-08-11T04:09:00Z",
  "actor": "EOS Real Project Discovery Engine",
  "action": "Executed Level 1 READ_ONLY discovery on C:\\Users\\valen\\Documents\\Fundacion, classified observed facts, derived facts, inferences, hypotheses, and unknowns without modifying filesystem or Git.",
  "command": "npm run discover:real & npm test & npm run verify:strict",
  "expected": "Target project observed strictly READ_ONLY. 9 discovery JSON artifacts saved. Decision state PASS_WITH_CONDITIONS. Target Fundacion item count strictly 0.",
  "actual": "Target directory C:\\Users\\valen\\Documents\\Fundacion confirmed 100% empty (0 items). READ_ONLY policy enforced. All 9 discovery JSON artifacts saved. Decision state PASS_WITH_CONDITIONS.",
  "result": "PASS",
  "artifacts": [
    "docs\\intelligence\\real_projects\\fundacion\\REAL_PROJECT_STATE.json",
    "docs\\intelligence\\real_projects\\fundacion\\REAL_PROJECT_DISCOVERY.json",
    "docs\\intelligence\\real_projects\\fundacion\\REAL_PROJECT_ARCHITECTURE_ASSESSMENT.json",
    "docs\\intelligence\\real_projects\\fundacion\\REAL_PROJECT_RISK_ASSESSMENT.json",
    "docs\\intelligence\\real_projects\\fundacion\\REAL_PROJECT_EVIDENCE.json",
    "docs\\intelligence\\real_projects\\fundacion\\REAL_PROJECT_UNCERTAINTIES.json",
    "docs\\intelligence\\real_projects\\fundacion\\REAL_PROJECT_CONTRADICTIONS.json",
    "docs\\intelligence/real_projects/fundacion/REAL_PROJECT_RECOMMENDATIONS.json",
    "docs\\intelligence/real_projects/fundacion/REAL_PROJECT_AUDIT_TRAIL.json",
    "docs\\audits\\EOS_PHASE_26_REAL_PROJECT_DISCOVERY.md"
  ],
  "logs": [
    "Discovery Mission: EXP-026-001 completed",
    "Level: EMPIRICAL_VALIDATION_LEVEL_1_READ_ONLY",
    "Write Barrier: INVIOLATE_DENY_ENFORCED",
    "Decision State: PASS_WITH_CONDITIONS",
    "Target Isolation: VERIFIED (0 items in Fundacion)"
  ],
  "environment": {
    "os": "Windows 11",
    "node": "v24.16.0"
  },
  "confidence": "HIGH",
  "risks": ["LEVEL 2+ implementation prohibited until Product Owner Level 2+ written sign-off"],
  "limitations": ["Level 1 READ_ONLY discovery validates target state without performing code modifications"],
  "related_spec": "docs/specs/fundacion/SPEC-0001-fundacion-core.md",
  "related_project": "PRJ-FUNDACION",
  "related_change": "749bfbc"
}
