{
  "$schema": "./schema.json",
  "id": "EVD-0019",
  "claim": "EOS Phase 20 Autonomous Engineering Operating Loop & Control Plane Integration completed: AutonomousEngineeringOperatingLoop class, 27-state operating loop state machine, OPERATING_LOOP_CONTRACT.json schema, 3-level scope isolation (READ_ONLY, SANDBOX_WRITE, EXTERNAL_WRITE), 8 synthetic end-to-end loops (LOOP-001 to LOOP-008), decision traceability logging, run:loop CLI script, and 247 total suite tests verified with 100% pass rate and zero external side effects.",
  "status": "VERIFIED",
  "scope": "EOS Control Plane Integrated Autonomous Engineering Operating Loop",
  "source": "Phase 20 Operating Loop Audit",
  "timestamp": "2026-08-11T02:31:45Z",
  "actor": "EOS Systems Architect & Operating Loop Integration Engineer",
  "action": "Implemented Operating Loop Orchestrator, 27-state state machine, contract schema, 3-level scope isolation model, 8 synthetic operating loop proving runs, negative tests, and verified target isolation.",
  "command": "npm test & npm run verify:strict & npm run run:loop",
  "expected": "Test suite 247/247 pass. Strict verification 300+ checks pass. Operating loop CLI script PASS. Fundacion folder 0 items.",
  "actual": "Test suite 247/247 passed in 515ms. All 8 synthetic operating loops completed with 100% scorecard metrics. External isolation check verified (0 items in Fundacion). Control plane version v0.3.0 established.",
  "result": "PASS",
  "artifacts": [
    "docs\\intelligence\\research\\RSC-0011-autonomous-engineering-operating-loop.json",
    "docs\\architecture\\AUTONOMOUS_ENGINEERING_OPERATING_LOOP.md",
    "docs\\orchestration\\OPERATING_LOOP_STATE_MACHINE.json",
    "docs\\orchestration\\OPERATING_LOOP_CONTRACT.json",
    "scripts\\engine\\autonomous-engineering-operating-loop.js",
    "tests\\operating-loop.test.js"
  ],
  "logs": [
    "Operating Loop Controller: AutonomousEngineeringOperatingLoop operational in scripts/engine/autonomous-engineering-operating-loop.js",
    "27-State Operating Loop State Machine: Operational from RECEIVED to COMPLETED/ROLLED_BACK",
    "3-Level Scope Model: READ_ONLY, SANDBOX_WRITE, EXTERNAL_WRITE active",
    "Synthetic Proving Loops: LOOP-001 through LOOP-008 succeeded",
    "Test Suite: 247/247 tests passed (100% pass rate in 515ms across 11 test suites)",
    "External Target Isolation: VERIFIED (0 items in Fundacion)"
  ],
  "environment": {
    "os": "Windows 11",
    "node": "v24.16.0"
  },
  "confidence": "HIGH",
  "risks": ["External implementation forbidden until Product Owner sign-off on 4 business GAPs"],
  "limitations": ["Operating loops execute in local synthetic mode prior to live commercial LLM API tokens"],
  "related_spec": "docs/specs/fundacion/SPEC-0001-fundacion-core.md",
  "related_project": "PRJ-EOS-CONTROL-PLANE",
  "related_change": "48d71f9"
}
