{
  "$schema": "./schema.json",
  "id": "EVD-0002",
  "claim": "Fundacion source code contains zero hardcoded secrets and uses safe textContent DOM sanitization against XSS.",
  "status": "VERIFIED",
  "scope": "Fundacion Security",
  "source": "Static Security Audit",
  "timestamp": "2026-08-10T23:05:00Z",
  "actor": "EOS Security Auditor",
  "action": "Audited source files for API keys, hardcoded passwords, unsafe innerHTML usage, and input sanitization.",
  "command": "view_file C:\\Users\\valen\\Documents\\Fundacion\\src\\js\\main.js",
  "expected": "Zero hardcoded secrets; textContent used exclusively for DOM error injection.",
  "actual": "Zero API keys found. main.js uses textContent on lines 74 and 82.",
  "result": "PASS",
  "artifacts": [
    "C:\\Users\\valen\\Documents\\Fundacion\\src\\js\\main.js"
  ],
  "logs": [
    "main.js line 74: if (el) el.textContent = message;",
    "main.js line 82: feedback.textContent = '';"
  ],
  "environment": {
    "os": "Windows 11"
  },
  "confidence": "HIGH",
  "risks": ["SEC-001: Backend API sanitization pending endpoint connection"],
  "limitations": ["CSP HTTP header unverified on local server"],
  "related_spec": "docs/specs/fundacion/SPEC-0001-fundacion-core.md",
  "related_project": "PRJ-FUNDACION",
  "related_change": "777a518"
}
