{
  "$schema": "./schema.json",
  "id": "EVD-0023",
  "claim": "EOS Phase 24 Independent Empirical Validation Standard & Verification Harness completed: EOS_INDEPENDENT_EMPIRICAL_VALIDATION_STANDARD.md, CLAIM_VALIDATION_MODEL.json (11 claim types), EVIDENCE_INDEPENDENCE_MODEL.json (5 independence levels I0-I4), FALSIFICATION_CONTRACT.json schema, CONTRADICTION_MODEL.json (5 cases A-E), VALIDATION_STATE_MACHINE.json (10 states), COMPLEXITY_BUDGET.json (within budget), IndependentVerificationHarness (0 false acceptance FAR=0, 0 false rejection FRR=0, 100% contradiction detection CDR=1.0, 100% evidence independence EIR=1.0), verify:independent CLI script, and 280 total suite tests verified with 100% pass rate and zero external side effects.",
  "status": "VERIFIED",
  "scope": "EOS Control Plane Independent Empirical Validation System & Verification Harness",
  "source": "Phase 24 Independent Empirical Validation Audit",
  "timestamp": "2026-08-11T03:49:00Z",
  "actor": "EOS Principal Engineer & Validation Architect",
  "action": "Implemented Independent Empirical Validation Standard, Claim Validation Model, Evidence Independence Model, Falsification Contract, Contradiction Model, Validation State Machine, Complexity Budget, Independent Verification Harness, synthetic falsification fixtures, negative tests, and verified target isolation.",
  "command": "npm test & npm run verify:strict & npm run verify:independent",
  "expected": "Test suite 280/280 pass. Strict verification 390+ checks pass. Independent verification CLI script PASS with EMPIRICAL_VALIDATION_PENDING_EXTERNAL_REALITY state. Fundacion folder 0 items.",
  "actual": "Test suite 280/280 passed in 1209ms. Independent verification harness CLI completed with harnessPassed=true (FAR=0, FRR=0, CDR=1, EIR=1). External isolation check verified (0 items in Fundacion). Control plane version v0.3.0 established.",
  "result": "PASS",
  "artifacts": [
    "docs\\governance\\EOS_INDEPENDENT_EMPIRICAL_VALIDATION_STANDARD.md",
    "docs\\governance\\CLAIM_VALIDATION_MODEL.json",
    "docs\\governance\\EVIDENCE_INDEPENDENCE_MODEL.json",
    "docs\\governance\\FALSIFICATION_CONTRACT.json",
    "docs\\governance\\CONTRADICTION_MODEL.json",
    "docs\\governance\\VALIDATION_STATE_MACHINE.json",
    "docs\\governance\\COMPLEXITY_BUDGET.json",
    "docs\\audits\\EOS_PHASE_24_INDEPENDENT_VALIDATION.md",
    "scripts\\engine\\independent-verification-harness.js",
    "tests\\independent-validation.test.js"
  ],
  "logs": [
    "Validation Standard: EOS_INDEPENDENT_EMPIRICAL_VALIDATION_STANDARD.md active defining 3 Layers of Truth and Falsification-First Axiom",
    "5 Independence Levels: I0 Self-Generated to I4 Empirical Real-World Validation active in EVIDENCE_INDEPENDENCE_MODEL.json",
    "Independent Verification Harness: IndependentVerificationHarness operational in scripts/engine/independent-verification-harness.js",
    "Falsification Metrics: FAR=0.0, FRR=0.0, CDR=1.0, EIR=1.0 verified",
    "Test Suite: 280/280 tests passed (100% pass rate in 1209ms across 15 test suites)",
    "External Target Isolation: VERIFIED (0 items in Fundacion)"
  ],
  "environment": {
    "os": "Windows 11",
    "node": "v24.16.0"
  },
  "confidence": "HIGH",
  "risks": ["External implementation forbidden until Product Owner sign-off on 4 business GAPs"],
  "limitations": ["Empirical validation state remains PENDING_EXTERNAL_REALITY until live commercial cloud infrastructure activation"],
  "related_spec": "docs/specs/fundacion/SPEC-0001-fundacion-core.md",
  "related_project": "PRJ-EOS-CONTROL-PLANE",
  "related_change": "0eb260d"
}
