{
  "$schema": "./schema.json",
  "id": "EVD-0001",
  "claim": "Fundacion source code adheres to modular HTML5/CSS3/JS standards with zero hardcoded syntax errors.",
  "status": "VERIFIED",
  "scope": "Fundacion Target Project",
  "source": "Static Code Audit & File Inspection",
  "timestamp": "2026-08-10T23:05:00Z",
  "actor": "EOS Quality Auditor",
  "action": "Audited index.html, main.css, and main.js for syntax, complexity, and duplicate code.",
  "command": "Get-ChildItem -Path C:\\Users\\valen\\Documents\\Fundacion -Recurse",
  "expected": "Clean modular code structure under 20 KB total bundle weight.",
  "actual": "Total uncompressed bundle weight is 17.06 KB with zero syntax or compilation errors.",
  "result": "PASS",
  "artifacts": [
    "C:\\Users\\valen\\Documents\\Fundacion\\index.html",
    "C:\\Users\\valen\\Documents\\Fundacion\\src\\styles\\main.css",
    "C:\\Users\\valen\\Documents\\Fundacion\\src\\js\\main.js"
  ],
  "logs": [
    "index.html: 185 lines (7.78 KB)",
    "main.css: 322 lines (6.75 KB)",
    "main.js: 90 lines (2.53 KB)"
  ],
  "environment": {
    "os": "Windows 11",
    "node": "v24.16.0"
  },
  "confidence": "HIGH",
  "risks": ["Q-001: node_modules pending npm install in target folder"],
  "limitations": ["Automated test runner not configured in target project"],
  "related_spec": "docs/specs/fundacion/SPEC-0001-fundacion-core.md",
  "related_project": "PRJ-FUNDACION",
  "related_change": "777a518"
}
