{
  "$schema": "./schema.json",
  "id": "EVD-0012",
  "claim": "EOS Phase 13 Tool-Agnostic Capability & Adapter Architecture completed: Capability Schema, Tool Registry (4 synthetic tools), Adapter Registry (4 synthetic adapters), Provider Registry (4 providers), RSC-0004 Research Study, Synthetic Mock Adapters, and 50 automated tests verified.",
  "status": "VERIFIED",
  "scope": "EOS Control Plane Tool-Agnostic Adapter & Ports Architecture",
  "source": "Phase 13 Tool-Agnostic Capability & Adapter Architecture Audit",
  "timestamp": "2026-08-11T00:00:00Z",
  "actor": "EOS Systems & Adapter Architect",
  "action": "Built tool-agnostic architecture blueprint, capability/tool/adapter/provider schemas and registries, synthetic mock adapters, 15 negative tests, and verified target isolation.",
  "command": "npm test & npm run verify:strict",
  "expected": "Test suite 50/50 pass. Strict verification 180+ checks pass. Fundacion folder 0 items.",
  "actual": "Test suite 50/50 passed in 158ms. External isolation check verified (0 items in Fundacion). Control plane version v0.3.0 established.",
  "result": "PASS",
  "artifacts": [
    "docs\\architecture\\TOOL_AGNOSTIC_ARCHITECTURE.md",
    "docs\\capabilities\\schema.json",
    "docs\\tools\\schema.json",
    "docs\\tools\\REGISTRY.json",
    "docs\\adapters\\schema.json",
    "docs\\adapters\\REGISTRY.json",
    "docs\\providers\\schema.json",
    "docs\\providers\\REGISTRY.json",
    "scripts\\adapters\\mock-code-adapter.js",
    "scripts\\adapters\\mock-research-adapter.js",
    "scripts\\adapters\\mock-test-adapter.js",
    "scripts\\adapters\\mock-browser-adapter.js",
    "tests\\adapter-architecture.test.js"
  ],
  "logs": [
    "Tool Registry: 4 synthetic mock tools registered in docs/tools/REGISTRY.json",
    "Adapter Registry: 4 synthetic mock adapters registered in docs/adapters/REGISTRY.json",
    "Provider Registry: 4 providers registered in docs/providers/REGISTRY.json",
    "Test Suite: 50/50 tests passed (100% pass rate in 158ms)",
    "External Target Isolation: VERIFIED (0 items in Fundacion)"
  ],
  "environment": {
    "os": "Windows 11",
    "node": "v24.16.0"
  },
  "confidence": "HIGH",
  "risks": ["External implementation forbidden until Product Owner sign-off on 4 business GAPs"],
  "limitations": ["Adapters operate via local synthetic mocks without real LLM vendor tokens"],
  "related_spec": "docs/specs/fundacion/SPEC-0001-fundacion-core.md",
  "related_project": "PRJ-EOS-CONTROL-PLANE",
  "related_change": "993cab2"
}
