{
  "$schema": "./schema.json",
  "id": "EVD-0011",
  "claim": "EOS Phase 12 Autonomous Engineering Factory & Execution Governance completed: Task Graph Engine, 7-Tier Autonomy & Risk Model, Team Composition, Reversibility Engine, Factory Architecture, Failure Handling, Agent Performance Memory, RSC-0003 Software Factory Study, Capability Verification Matrix, and 33 automated tests verified.",
  "status": "VERIFIED",
  "scope": "EOS Control Plane Factory Governance & Execution Architecture",
  "source": "Phase 12 Autonomous Engineering Factory Audit",
  "timestamp": "2026-08-10T23:50:00Z",
  "actor": "EOS Systems & Factory Governance Architect",
  "action": "Built task graph schemas, autonomy risk model, team composition rules, reversibility tiers, failure handling policies, performance memory, capability matrix, test suite, and verified external target isolation.",
  "command": "npm test & npm run verify:strict",
  "expected": "Test suite 33/33 pass. Strict verification 150+ checks pass. Fundacion folder 0 items.",
  "actual": "Test suite 33/33 passed in 900ms. External isolation check verified (0 items in Fundacion). Control plane version v0.3.0 established.",
  "result": "PASS",
  "artifacts": [
    "docs\\orchestration\\TASK_GRAPH.json",
    "docs\\policies\\AUTONOMY_RISK_MODEL.json",
    "docs\\agents\\TEAM_COMPOSITION.json",
    "docs\\policies\\REVERSIBILITY_ENGINE.json",
    "docs\\orchestration\\ENGINEERING_FACTORY.md",
    "docs\\orchestration\\FAILURE_HANDLING.json",
    "docs\\knowledge\\AGENT_PERFORMANCE_MEMORY.json",
    "docs\\intelligence\\research\\RSC-0003-software-factory-study.json",
    "docs\\intelligence\\CAPABILITY_VERIFICATION_MATRIX.md",
    "tests\\factory-governance.test.js"
  ],
  "logs": [
    "Task Graph Engine: TASK_GRAPH.json active with Given-When-Then acceptance criteria",
    "Autonomy & Risk Model: 7 autonomy levels & 12-tier risk taxonomy active",
    "Reversibility Engine: 5 reversibility tiers enforcing inverse autonomy scaling",
    "Test Suite: 33/33 tests passed (100% pass rate in 900ms)",
    "External Target Isolation: VERIFIED (0 items in Fundacion)"
  ],
  "environment": {
    "os": "Windows 11",
    "node": "v24.16.0"
  },
  "confidence": "HIGH",
  "risks": ["External implementation forbidden until Product Owner sign-off on 4 business GAPs"],
  "limitations": ["Autonomous Engineering Factory operates local-first via policy simulation and strict execution gates"],
  "related_spec": "docs/specs/fundacion/SPEC-0001-fundacion-core.md",
  "related_project": "PRJ-EOS-CONTROL-PLANE",
  "related_change": "6dbc500"
}
