{
  "$schema": "./schema.json",
  "id": "EVD-0009",
  "claim": "EOS v0.3.0 Control Plane Hardening completed: Agent Registry (16 agents), Selection Engine, Policy Engine, State Machine (19 states), Dry-Run Engine, Rollback Strategy, Learning Loop, Research Engine, and test suite verified.",
  "status": "VERIFIED",
  "scope": "EOS Control Plane Architecture & Governance Hardening",
  "source": "Phase 10 Control Plane Hardening Audit",
  "timestamp": "2026-08-10T23:40:00Z",
  "actor": "EOS System Architect",
  "action": "Implemented local-first control plane architecture schemas, policy engine, state machine, ADR-0002, test suite, and verified external target isolation.",
  "command": "npm test & npm run verify:strict",
  "expected": "Test suite 5/5 pass. Strict verification 77+ checks pass. Fundacion folder 0 items.",
  "actual": "Test suite 5/5 passed in 101ms. External isolation check verified (0 items in Fundacion). Control plane version v0.3.0 established.",
  "result": "PASS",
  "artifacts": [
    "docs\\architecture\\adrs\\ADR-0002-autonomous-control-plane-architecture.md",
    "docs\\agents\\REGISTRY.json",
    "docs\\agents\\SELECTION_ENGINE.json",
    "docs\\orchestration\\TASK_DECOMPOSITION.json",
    "docs\\policies\\POLICY_ENGINE.json",
    "docs\\projects\\STATE_MACHINE.json",
    "docs\\orchestration\\DRY_RUN_ENGINE.json",
    "docs\\architecture\\ROLLBACK_STRATEGY.md",
    "docs\\knowledge\\CONTINUOUS_LEARNING_LOOP.md",
    "docs\\knowledge\\RESEARCH_ENGINE.md",
    "tests\\control-plane-hardening.test.js"
  ],
  "logs": [
    "Agent Registry: 16 specialized agent roles defined",
    "State Machine: 19 project lifecycle states & transition rules defined",
    "Policy Engine: POL-001 through POL-004 rules active",
    "Test Suite: 5/5 tests passed (100% pass rate)",
    "External Target Isolation: VERIFIED (0 items in Fundacion)"
  ],
  "environment": {
    "os": "Windows 11",
    "node": "v24.16.0"
  },
  "confidence": "HIGH",
  "risks": ["External implementation forbidden until Product Owner sign-off on 4 business GAPs"],
  "limitations": ["Control Plane operates local-first without unneeded microservice bloat"],
  "related_spec": "docs/specs/fundacion/SPEC-0001-fundacion-core.md",
  "related_project": "PRJ-EOS-CONTROL-PLANE",
  "related_change": "b02733b"
}
