{
  "$schema": "./schema.json",
  "id": "EVD-0022",
  "claim": "EOS Phase 23 System-Wide Integrity, Governance & Readiness Audit completed: 5-level audit evaluation (L1 Structural, L2 Behavioral, L3 Cross-System, L4 Adversarial, L5 Epistemic), 28 audit questions answered, 11 audit artifacts produced, SYSTEM_READY_WITH_CONDITIONS decision state established, audit:system CLI script active, and 276 total suite tests verified with 100% pass rate and zero external side effects.",
  "status": "VERIFIED",
  "scope": "EOS Control Plane System-Wide Integrity Audit & Readiness Assessment",
  "source": "Phase 23 System-Wide Audit",
  "timestamp": "2026-08-11T03:31:30Z",
  "actor": "EOS Principal Engineer & Governance Auditor",
  "action": "Executed System-Wide Integrity Audit Engine, evaluated 5 audit levels, answered 28 questions, audited invariants, contradictions, governance matrix, state machines, evidence, security, complexity, and readiness assessment.",
  "command": "npm test & npm run verify:strict & npm run audit:system",
  "expected": "Test suite 276/276 pass. Strict verification 350+ checks pass. Audit CLI script PASS with SYSTEM_READY_WITH_CONDITIONS state. Fundacion folder 0 items.",
  "actual": "Test suite 276/276 passed in 915ms. System audit CLI completed with SYSTEM_READY_WITH_CONDITIONS decision state. External isolation check verified (0 items in Fundacion). Control plane version v0.3.0 established.",
  "result": "PASS",
  "artifacts": [
    "docs\\audits\\EOS_SYSTEM_AUDIT_REPORT.md",
    "docs\\audits\\EOS_SYSTEM_AUDIT_FINDINGS.json",
    "docs\\audits\\EOS_SYSTEM_INVARIANTS.json",
    "docs\\audits\\EOS_SYSTEM_CONTRADICTIONS.json",
    "docs\\audits\\EOS_SYSTEM_GOVERNANCE_MATRIX.json",
    "docs\\audits\\EOS_SYSTEM_STATE_MACHINE_AUDIT.json",
    "docs\\audits\\EOS_SYSTEM_EVIDENCE_AUDIT.json",
    "docs\\audits\\EOS_SYSTEM_SECURITY_AUDIT.json",
    "docs\\audits/EOS_SYSTEM_COMPLEXITY_AUDIT.json",
    "docs\\audits\\EOS_SYSTEM_READINESS_ASSESSMENT.json",
    "docs\\audits\\EOS_SYSTEM_AUDIT_EVIDENCE.json",
    "scripts\\engine\\system-wide-integrity-audit.js",
    "tests\\system-integrity-audit.test.js"
  ],
  "logs": [
    "System-Wide Audit Engine: SystemWideIntegrityAuditEngine operational in scripts/engine/system-wide-integrity-audit.js",
    "5-Level Audit: L1 Structural, L2 Behavioral, L3 Cross-System, L4 Adversarial, L5 Epistemic PASSED",
    "28 Audit Questions: Evaluated and answered with clear evidence",
    "Decision Gate State: SYSTEM_READY_WITH_CONDITIONS established",
    "Test Suite: 276/276 tests passed (100% pass rate in 915ms across 14 test suites)",
    "External Target Isolation: VERIFIED (0 items in Fundacion)"
  ],
  "environment": {
    "os": "Windows 11",
    "node": "v24.16.0"
  },
  "confidence": "HIGH",
  "risks": ["External implementation forbidden until Product Owner sign-off on 4 business GAPs"],
  "limitations": ["System audit verifies synthetic readiness prior to live commercial cloud infrastructure activation"],
  "related_spec": "docs/specs/fundacion/SPEC-0001-fundacion-core.md",
  "related_project": "PRJ-EOS-CONTROL-PLANE",
  "related_change": "61934f2"
}
