{
  "$schema": "./schema.json",
  "id": "EVD-0010",
  "claim": "EOS Phase 11 Engineering Intelligence System & Meta-Verification completed: Source Registry (10 sources), Epistemological Study RSC-0001 (Engram/Gentleman), Pattern Extraction (PAT-0001-3, ANT-0001-2), Industry Comparison Matrix (CMP-0001), Capability Adoption (CAP-0001, DEC-INT-0001), Meta-Verification rules, Knowledge Graph Model, and 19 automated tests verified.",
  "status": "VERIFIED",
  "scope": "EOS Control Plane Engineering Intelligence & Meta-Verification Architecture",
  "source": "Phase 11 Engineering Intelligence Audit & Execution",
  "timestamp": "2026-08-10T23:46:00Z",
  "actor": "EOS Systems & Intelligence Architect",
  "action": "Built intelligence sources, research studies, pattern/antipattern records, multi-org comparison matrix, meta-verification system, knowledge graph model, test runner integration, and verified target isolation.",
  "command": "npm test & npm run verify:strict",
  "expected": "Test suite 19/19 pass. Strict verification 120+ checks pass. Fundacion folder 0 items.",
  "actual": "Test suite 19/19 passed in 320ms. External isolation check verified (0 items in Fundacion). Control plane version v0.3.0 established.",
  "result": "PASS",
  "artifacts": [
    "docs\\intelligence\\sources\\SOURCES.json",
    "docs\\intelligence\\research\\RSC-0001-gentleman-engram-study.json",
    "docs\\intelligence\\research\\RSC-0002-multi-agent-orchestration-study.json",
    "docs\\intelligence\\patterns\\PAT-0001-spec-driven-development.json",
    "docs\\intelligence\\patterns\\PAT-0002-evidence-first-verification.json",
    "docs\\intelligence\\anti-patterns\\ANT-0001-premature-external-implementation.json",
    "docs\\intelligence\\anti-patterns\\ANT-0002-tool-first-blind-copying.json",
    "docs\\intelligence\\comparisons\\CMP-0001-industry-engineering-matrix.json",
    "docs\\intelligence\\capabilities\\CAP-0001-persistent-engineering-memory.json",
    "docs\\intelligence\\decisions\\DEC-INT-0001-adopt-engram-memory-protocol.json",
    "docs\\intelligence\\META_VERIFICATION.md",
    "docs\\intelligence\\KNOWLEDGE_GRAPH_MODEL.md",
    "tests\\intelligence.test.js"
  ],
  "logs": [
    "Source Registry: 10 authoritative sources registered across 6 categories",
    "Epistemological Study: RSC-0001 Engram/Gentleman memory analysis complete",
    "Multi-Org Matrix: CMP-0001 comparing EOS, Gentleman, OpenAI, Anthropic, Google, Microsoft across 17 dimensions",
    "Test Suite: 19/19 tests passed (100% pass rate in 320ms)",
    "External Isolation: VERIFIED (0 items in Fundacion)"
  ],
  "environment": {
    "os": "Windows 11",
    "node": "v24.16.0"
  },
  "confidence": "HIGH",
  "risks": ["External implementation forbidden until Product Owner sign-off on 4 business GAPs"],
  "limitations": ["Engineering Intelligence system operates local-first using structured JSON & Markdown schemas"],
  "related_spec": "docs/specs/fundacion/SPEC-0001-fundacion-core.md",
  "related_project": "PRJ-EOS-CONTROL-PLANE",
  "related_change": "c3f70f8"
}
