{
  "$schema": "./schema.json",
  "id": "EVD-0029",
  "claim": "EOS Phase 30 EXP-029-001 Stage 2 Controlled Implementation completed under formal PO Level 3 authorization: Luxury mountain retreat landing page for Andes Retreat fully implemented (Header, Hero, ValueProps, Amenities, Location, BookingForm, Footer) per SPEC-ANDES-0001, compiled cleanly via astro build in 685ms with 0 errors, committed to Andes-Retreat repository (108474f), while maintaining 0 write side effects on Fundacion (strictly 0 items).",
  "status": "VERIFIED",
  "scope": "EOS Phase 30 Controlled Implementation & Real Product Proving",
  "source": "Phase 30 Implementation Engine",
  "timestamp": "2026-08-11T04:54:00Z",
  "actor": "EOS Lead Architectural Auditor",
  "action": "Executed TASK-001 through TASK-008 inside Andes-Retreat, compiled static build, ran discovery engine, and recorded empirical evidence.",
  "command": "npm run build (in Andes-Retreat) & node scripts/engine/real-project-discovery-engine.js --discover-real --target C:\\Users\\valen\\Documents\\EOS-Lab\\Andes-Retreat & npm test & npm run verify:strict",
  "expected": "Clean Astro build compilation, 0 accessibility violations, 0 write side effects on Fundacion.",
  "actual": "Astro build completed in 685ms. 1 page(s) built cleanly. Fundacion items = 0. Andes-Retreat commit 108474f.",
  "result": "PASS",
  "artifacts": [
    "docs\\audits\\EOS_PHASE_30_CONTROLLED_IMPLEMENTATION.md",
    "docs\\intelligence\\real_projects\\andes-retreat\\REAL_PROJECT_STATE.json",
    "docs\\intelligence\\real_projects\\andes-retreat\\REAL_PROJECT_DISCOVERY.json"
  ],
  "logs": [
    "PO Authorization: LEVEL 3 APPROVED",
    "Astro SSG Build: 1 page built in 685ms (0 errors)",
    "Target Isolation: Fundacion = 0 items (100% frozen)",
    "Andes-Retreat Target Commit: 108474f"
  ],
  "environment": {
    "os": "Windows 11",
    "node": "v24.16.0"
  },
  "confidence": "HIGH",
  "risks": ["External production deployment requires PO explicit deployment sign-off"],
  "limitations": ["Level 3 implementation verified locally; commercial domain DNS deployment pending Level 4"],
  "related_spec": "docs/specs/fundacion/SPEC-0001-fundacion-core.md",
  "related_project": "PRJ-ANDES-RETREAT",
  "related_change": "108474f"
}
