{
  "$schema": "./schema.json",
  "id": "EVD-0030",
  "claim": "EOS Phase 31 External Product Validation completed: Git forensic inspection confirmed clean repository state (108474f), reproducible Astro SSG build verified in 649ms (0 errors), compiled dist/index.html audited across Zero-JS client bundle (0 <script> tags), WCAG AA accessibility, meta SEO, and zero write side effects on Fundacion (strictly 0 items).",
  "status": "VERIFIED",
  "scope": "EOS Phase 31 External Product Validation & Reproducible Audit",
  "source": "Phase 31 External Audit Engine",
  "timestamp": "2026-08-11T05:00:00Z",
  "actor": "EOS Independent Product Auditor",
  "action": "Performed Git forensic audit, purged dist build, re-compiled Astro static page, inspected dist/index.html, and validated Zero-JS performance, WCAG AA, SEO, and isolation invariants.",
  "command": "git status & git log & Remove-Item dist,.astro -Recurse -Force & npm run build & npm test & npm run verify:strict",
  "expected": "0 <script> tags in dist/index.html. 0 build errors. 0 files modified outside target.",
  "actual": "dist/index.html contains 0 <script> tags. Build completed in 649ms. Fundacion items = 0.",
  "result": "PASS",
  "artifacts": [
    "docs\\audits\\EOS_PHASE_31_EXTERNAL_PRODUCT_VALIDATION.md"
  ],
  "logs": [
    "Git Forensic: Clean repository on branch main (108474f)",
    "Reproducible Build: 1 page built in 649ms",
    "Zero-JS Verification: 0 <script> tags in dist/index.html",
    "Target Isolation: Fundacion = 0 items (100% frozen)"
  ],
  "environment": {
    "os": "Windows 11",
    "node": "v24.16.0"
  },
  "confidence": "HIGH",
  "risks": ["External commercial domain deployment requires PO explicit deployment authorization"],
  "limitations": ["Level 4 product audit verified static HTML/CSS build; live browser E2E session requires active web server"],
  "related_spec": "docs/specs/fundacion/SPEC-0001-fundacion-core.md",
  "related_project": "PRJ-ANDES-RETREAT",
  "related_change": "108474f"
}
