{
  "$schema": "./schema.json",
  "id": "EVD-0024",
  "claim": "EOS Phase 25 Forensic Architecture & Empirical Validation Audit completed: 20-step forensic pipeline executed, 15 engines audited (100% single responsibility and active usage), 7 state machines aligned, 8 forensic audit artifacts produced, READY_FOR_EMPIRICAL_VALIDATION readiness state assigned, and 280 total suite tests verified with 100% pass rate and zero external side effects.",
  "status": "VERIFIED",
  "scope": "EOS Control Plane Forensic Architecture & Empirical Validation Audit",
  "source": "Phase 25 Forensic Audit",
  "timestamp": "2026-08-11T04:04:00Z",
  "actor": "EOS Principal Engineer & Forensic Auditor",
  "action": "Executed 20-step forensic audit pipeline, audited engine responsibilities, state machines, contract schemas, code coverage, test quality, circularity, self-certification, claim epistemology, adversarial safety, and complexity budget.",
  "command": "npm test & npm run verify:strict & npm run verify:independent & npm run audit:system",
  "expected": "Test suite 280/280 pass. Strict verification 400+ checks pass. Forensic audit deliverables complete with READY_FOR_EMPIRICAL_VALIDATION state. Fundacion folder 0 items.",
  "actual": "Test suite 280/280 passed in 1209ms. Strict verification 407/407 passed. Independent verification harness passed (FAR=0, FRR=0, CDR=1.0, EIR=1.0). Target Fundacion folder verified 100% empty (0 items). Control plane version v0.3.0 established.",
  "result": "PASS",
  "artifacts": [
    "docs\\audits\\EOS_FORENSIC_AUDIT_REPORT.md",
    "docs\\audits\\EOS_FORENSIC_FINDINGS.json",
    "docs\\audits\\EOS_FORENSIC_INVARIANTS.json",
    "docs\\audits\\EOS_FORENSIC_CONTRADICTIONS.json",
    "docs\\audits\\EOS_FORENSIC_REDUNDANCY.json",
    "docs\\audits\\EOS_FORENSIC_COMPLEXITY.json",
    "docs\\audits\\EOS_FORENSIC_EVIDENCE.json",
    "docs\\audits\\EOS_FORENSIC_READINESS.json"
  ],
  "logs": [
    "Forensic Pipeline: 20-step audit pipeline completed cleanly",
    "15 Engines Audited: 100% single responsibility, zero orphaned engines",
    "7 State Machines Audited: 100% transition compatibility and terminal state alignment",
    "Readiness State: READY_FOR_EMPIRICAL_VALIDATION assigned",
    "Test Suite: 280/280 tests passed across 15 test suites",
    "External Target Isolation: VERIFIED (0 items in Fundacion)"
  ],
  "environment": {
    "os": "Windows 11",
    "node": "v24.16.0"
  },
  "confidence": "HIGH",
  "risks": ["External implementation forbidden until Product Owner sign-off on 4 business GAPs"],
  "limitations": ["Forensic audit validates synthetic control plane state prior to live commercial cloud infrastructure activation"],
  "related_spec": "docs/specs/fundacion/SPEC-0001-fundacion-core.md",
  "related_project": "PRJ-EOS-CONTROL-PLANE",
  "related_change": "9aff55a"
}
