{
  "$schema": "./schema.json",
  "id": "EVD-0018",
  "claim": "EOS Phase 19 Autonomous Self-Evaluation, Learning & Evolution Engine completed: AutonomousSelfEvolutionEngine class, 10-state self-assessment classifier, capability & governance gap detection, EVOLUTION_STATE_MACHINE.json (18 proposal states), Self-Modification Protection Gate (Level 2+ authorization), Meta-Meta-Verification, Performance Delta Analysis, 10 synthetic self-evolution missions (SELF-EVOLUTION-001 to SELF-EVOLUTION-010), evaluate:self CLI script, and 229 total suite tests verified with 100% pass rate and zero external side effects.",
  "status": "VERIFIED",
  "scope": "EOS Control Plane Self-Evaluation & Evolution Governance Engine",
  "source": "Phase 19 Autonomous Self-Evaluation Audit",
  "timestamp": "2026-08-11T02:24:00Z",
  "actor": "EOS Systems Architect & Self-Evolution Engineer",
  "action": "Implemented Self-Evaluation Engine, 18-state evolution state machine, self-modification protection gates, meta-meta-verification, 10 synthetic self-evolution missions, negative tests, and verified target isolation.",
  "command": "npm test & npm run verify:strict & npm run evaluate:self",
  "expected": "Test suite 229/229 pass. Strict verification 300+ checks pass. Self-evaluation eval script PASS. Fundacion folder 0 items.",
  "actual": "Test suite 229/229 passed in 698ms. All 10 synthetic self-evolution missions verified with zero mutations. External isolation check verified (0 items in Fundacion). Control plane version v0.3.0 established.",
  "result": "PASS",
  "artifacts": [
    "docs\\intelligence\\research\\RSC-0010-autonomous-self-evaluation-evolution.json",
    "docs\\architecture\\AUTONOMOUS_SELF_EVOLUTION_ENGINE.md",
    "docs\\orchestration\\EVOLUTION_STATE_MACHINE.json",
    "docs\\evolution\\schema.json",
    "docs\\evolution\\REGISTRY.json",
    "scripts\\engine\\autonomous-self-evolution-engine.js",
    "tests\\self-evolution.test.js"
  ],
  "logs": [
    "Self-Observation Engine: AutonomousSelfEvolutionEngine operational in scripts/engine/autonomous-self-evolution-engine.js",
    "Self-Assessment Classifier: 10 states operational with evidence-backed evaluation",
    "Evolution State Machine: 18 states operational from DETECTED to VERIFIED/REJECTED",
    "Self-Modification Protection Gate: Enforcing Level 2+ Product Owner authorization for governance changes",
    "Test Suite: 229/229 tests passed (100% pass rate in 698ms across 10 test suites)",
    "External Target Isolation: VERIFIED (0 items in Fundacion)"
  ],
  "environment": {
    "os": "Windows 11",
    "node": "v24.16.0"
  },
  "confidence": "HIGH",
  "risks": ["External implementation forbidden until Product Owner sign-off on 4 business GAPs"],
  "limitations": ["Self-evolution proposals operate in local synthetic mode prior to live commercial LLM API tokens"],
  "related_spec": "docs/specs/fundacion/SPEC-0001-fundacion-core.md",
  "related_project": "PRJ-EOS-CONTROL-PLANE",
  "related_change": "01951d4"
}
