{
  "$schema": "./schema.json",
  "id": "EVD-0014",
  "claim": "EOS Phase 15 Autonomous Engineering Execution Simulator & Orchestration Runtime completed: AutonomousExecutionRuntime class, 16-State Action Lifecycle Machine, Versioned Replanning Engine, Execution History Observability, RSC-0006 Research Study, 11 Scenario Executions (SUCCESS, TOOL_FAILURE, VERIFICATION_FAILURE, POLICY_DENY, AUTHORIZATION_MISSING, AUTONOMY_INSUFFICIENT, DEPENDENCY_FAILURE, RETRY_EXHAUSTION, ROLLBACK, REPLAN, FUNDACION_WRITE_ATTEMPT), and 100 automated unit/integration tests verified.",
  "status": "VERIFIED",
  "scope": "EOS Control Plane Autonomous Execution Runtime & State Engine",
  "source": "Phase 15 Autonomous Execution Runtime Audit",
  "timestamp": "2026-08-11T00:09:00Z",
  "actor": "EOS Systems Architect & Runtime Orchestration Engineer",
  "action": "Built autonomous execution runtime architecture, 16-state action machine, versioned replan engine, 11 deterministic scenarios, 20 negative tests, and verified target isolation.",
  "command": "npm test & npm run verify:strict",
  "expected": "Test suite 100/100 pass. Strict verification 220+ checks pass. Fundacion folder 0 items.",
  "actual": "Test suite 100/100 passed in 208ms. External isolation check verified (0 items in Fundacion). Control plane version v0.3.0 established.",
  "result": "PASS",
  "artifacts": [
    "docs\\intelligence\\research\\RSC-0006-autonomous-execution-runtime.json",
    "docs\\architecture\\AUTONOMOUS_EXECUTION_RUNTIME.md",
    "docs\\orchestration\\EXECUTION_RUNTIME.json",
    "docs\\orchestration\\EXECUTION_STATE_MACHINE.json",
    "docs\\orchestration\\REPLAN_ENGINE.json",
    "docs\\orchestration\\EXECUTION_HISTORY.json",
    "scripts\\engine\\autonomous-execution-runtime.js",
    "tests\\execution-runtime.test.js"
  ],
  "logs": [
    "State Machine: 16 action states and transition rules active in docs/orchestration/EXECUTION_STATE_MACHINE.json",
    "Replan Engine: Versioned replanning (e.g. PLAN-001-R1) active in docs/orchestration/REPLAN_ENGINE.json",
    "Execution History: Action observability active in docs/orchestration/EXECUTION_HISTORY.json",
    "Test Suite: 100/100 tests passed (100% pass rate in 208ms)",
    "External Target Isolation: VERIFIED (0 items in Fundacion)"
  ],
  "environment": {
    "os": "Windows 11",
    "node": "v24.16.0"
  },
  "confidence": "HIGH",
  "risks": ["External implementation forbidden until Product Owner sign-off on 4 business GAPs"],
  "limitations": ["Runtime operates via local deterministic synthetic adapters without real LLM vendor tokens"],
  "related_spec": "docs/specs/fundacion/SPEC-0001-fundacion-core.md",
  "related_project": "PRJ-EOS-CONTROL-PLANE",
  "related_change": "181570e"
}
