{
  "$schema": "./schema.json",
  "id": "EVD-0016",
  "claim": "EOS Phase 17 Engineering Factory & Autonomous Decision Optimization completed: StrategyEngine class, StrategySimulator class, StrategySelectionEngine class, 18-Dimensional Strategy Selection Policy, Decision Record Schema & Auditable Decision Logs (WHY_SELECTED vs WHY_REJECTED), Engineering Economics Model, Agent & Tool Performance Memory Registries, Synthetic Project Fixtures (synthetic-mobile, synthetic-ai-agent, synthetic-migration, synthetic-security-remediation), RSC-0008 Research Study, CLI simulate:strategies command, 14 Positive Tests, 8 Negative Tests (174 total suite tests) verified.",
  "status": "VERIFIED",
  "scope": "EOS Control Plane Engineering Factory & Decision Optimizer",
  "source": "Phase 17 Engineering Factory Audit",
  "timestamp": "2026-08-11T00:42:00Z",
  "actor": "EOS Systems Architect & Decision Optimization Engineer",
  "action": "Built Engineering Factory architecture, Strategy Engine, Strategy Simulator, Strategy Selection Engine, decision transparency logs, economic model, performance memory registries, synthetic fixtures, positive/negative test suites, and verified target isolation.",
  "command": "npm test & npm run verify:strict & npm run simulate:strategies",
  "expected": "Test suite 174/174 pass. Strict verification 270+ checks pass. Strategy simulation PASS. Fundacion folder 0 items.",
  "actual": "Test suite 174/174 passed in 381ms. Strategy simulation output verified. External isolation check verified (0 items in Fundacion). Control plane version v0.3.0 established.",
  "result": "PASS",
  "artifacts": [
    "docs\\intelligence\\research\\RSC-0008-engineering-factory-strategy-optimization.json",
    "docs\\architecture\\ENGINEERING_FACTORY.md",
    "docs\\intelligence\\ENGINEERING_ECONOMICS.md",
    "docs\\orchestration\\STRATEGY_ENGINE.json",
    "docs\\orchestration\\STRATEGY_SELECTION_POLICY.json",
    "docs\\decisions\\STRATEGY_DECISIONS\\schema.json",
    "docs\\intelligence\\AGENT_PERFORMANCE_MEMORY.json",
    "docs\\intelligence\\TOOL_PERFORMANCE_MEMORY.json",
    "scripts\\engine\\strategy-engine.js",
    "scripts\\engine\\strategy-simulator.js",
    "scripts\\engine\\strategy-selection-engine.js",
    "scripts\\engine\\simulate-strategies.js",
    "tests\\strategy-engine.test.js"
  ],
  "logs": [
    "Strategy Engine: Multi-candidate strategy generation active in scripts/engine/strategy-engine.js",
    "Strategy Simulator: Zero side-effect path prediction active in scripts/engine/strategy-simulator.js",
    "Strategy Selection Engine: 18-dimensional scoring active in scripts/engine/strategy-selection-engine.js",
    "Decision Records: Auditable WHY_SELECTED vs WHY_REJECTED logs active in docs/decisions/STRATEGY_DECISIONS/schema.json",
    "Economic Model: Provider-neutral dimensions active in docs/intelligence/ENGINEERING_ECONOMICS.md",
    "Performance Memory: Synthetic tracking active in docs/intelligence/AGENT_PERFORMANCE_MEMORY.json & TOOL_PERFORMANCE_MEMORY.json",
    "Test Suite: 174/174 tests passed (100% pass rate in 381ms)",
    "External Target Isolation: VERIFIED (0 items in Fundacion)"
  ],
  "environment": {
    "os": "Windows 11",
    "node": "v24.16.0"
  },
  "confidence": "HIGH",
  "risks": ["External implementation forbidden until Product Owner sign-off on 4 business GAPs"],
  "limitations": ["Strategies operate via local synthetic models prior to live commercial API tokens"],
  "related_spec": "docs/specs/fundacion/SPEC-0001-fundacion-core.md",
  "related_project": "PRJ-EOS-CONTROL-PLANE",
  "related_change": "a4a362f"
}
